{
  "$schema": "http://json-schema.org/draft-07/schema#",
  "$id": "https://fglpkg.io/schema/v1/fglpkg.schema.json",
  "title": "fglpkg manifest",
  "description": "Schema for fglpkg.json — the package manifest used by the fglpkg CLI and registry.",
  "type": "object",
  "additionalProperties": false,
  "required": ["name", "version"],
  "properties": {
    "$schema": {
      "type": "string",
      "description": "Optional schema reference so editors can provide autocomplete and validation."
    },
    "type": {
      "type": "string",
      "enum": ["bdl", "webcomponent"],
      "default": "bdl",
      "description": "Package kind. \"bdl\" (default) ships compiled Genero modules and optional Java JARs. \"webcomponent\" ships Genero webcomponent bundles (html/css/js) under variant 'webcomponent'."
    },
    "name": {
      "type": "string",
      "description": "Package name. Must be unique within a registry; conventionally lowercase with no spaces.",
      "pattern": "^[a-zA-Z0-9][a-zA-Z0-9_-]*$",
      "minLength": 1,
      "maxLength": 128
    },
    "version": {
      "type": "string",
      "description": "Package version in semver form (MAJOR.MINOR.PATCH, optionally with -prerelease).",
      "pattern": "^\\d+\\.\\d+\\.\\d+(-[0-9A-Za-z.-]+)?(\\+[0-9A-Za-z.-]+)?$"
    },
    "description": {
      "type": "string",
      "description": "One-line summary shown by `fglpkg search` and `fglpkg info`."
    },
    "author": {
      "type": "string",
      "description": "Package author (name, email, or Name <email@example.com>)."
    },
    "license": {
      "type": "string",
      "description": "SPDX license identifier (e.g. MIT, Apache-2.0) or a custom string."
    },
    "repository": {
      "type": "string",
      "description": "URL of the source repository (e.g. https://github.com/org/repo)."
    },
    "keywords": {
      "type": "array",
      "description": "Free-form tags that aid registry search and discovery (e.g. [\"database\", \"utilities\"]).",
      "items": { "type": "string" },
      "uniqueItems": true
    },
    "main": {
      "type": "string",
      "description": "Primary .42m entry point for this package."
    },
    "visibility": {
      "type": "string",
      "enum": ["public", "private"],
      "description": "Who can see this package on the registry. Defaults to public. Set when the package is first created; ignored on subsequent publishes."
    },
    "genero": {
      "type": "string",
      "description": "Semver constraint for Genero BDL runtime compatibility (e.g. \"^6.0.0\", \">=4.01 <7\"). Omit or use \"*\" to indicate any Genero version."
    },
    "root": {
      "type": "string",
      "description": "Base directory for package files, relative to this manifest. Defaults to \".\"."
    },
    "files": {
      "type": "array",
      "description": "Glob patterns of files to include in the published zip. Defaults to [\"*.42m\", \"*.42f\", \"*.sch\"] when omitted.",
      "items": { "type": "string" },
      "uniqueItems": true
    },
    "bin": {
      "type": "object",
      "description": "Command-line scripts shipped with the package. Keys are command names; values are paths to executable scripts relative to the package root.",
      "additionalProperties": { "type": "string" }
    },
    "docs": {
      "type": "array",
      "description": "Glob patterns of documentation files to include in the published zip (e.g. [\"README.md\", \"docs/**/*.md\"]).",
      "items": { "type": "string" },
      "uniqueItems": true
    },
    "programs": {
      "type": "array",
      "description": "Module names (without .42m) that declare MAIN blocks and can be launched via `fglpkg bdl`.",
      "items": { "type": "string" },
      "uniqueItems": true
    },
    "webcomponents": {
      "type": "array",
      "description": "COMPONENTTYPE names this package provides. Required (non-empty) when \"type\" is \"webcomponent\"; forbidden otherwise. Each name must match the Genero COMPONENTTYPE lexical rule and correspond to a webcomponents/<NAME>/ source directory.",
      "items": {
        "type": "string",
        "pattern": "^[A-Za-z0-9][A-Za-z0-9_-]*$"
      },
      "minItems": 1,
      "uniqueItems": true
    },
    "hooks": {
      "type": "object",
      "description": "Declarative lifecycle steps. Each event (preinstall/postinstall/prepublish/postpublish/preuninstall) maps to an ordered list of operations from a fixed vocabulary; arbitrary shell commands are not supported.",
      "additionalProperties": false,
      "properties": {
        "preinstall":   { "$ref": "#/definitions/hookList" },
        "postinstall":  { "$ref": "#/definitions/hookList" },
        "prepublish":   { "$ref": "#/definitions/hookList" },
        "postpublish":  { "$ref": "#/definitions/hookList" },
        "preuninstall": { "$ref": "#/definitions/hookList" }
      }
    },
    "dependencies": {
      "$ref": "#/definitions/dependencyBucket",
      "description": "Production dependencies — required at runtime by consumers of this package. Keys must be \"fgl\" or \"java\"."
    },
    "devDependencies": {
      "$ref": "#/definitions/dependencyBucket",
      "description": "Development-only dependencies for the root project (test harnesses, linters, etc.). Never pulled in transitively when another project depends on this package."
    },
    "optionalDependencies": {
      "$ref": "#/definitions/dependencyBucket",
      "description": "Dependencies that are attempted like production deps but whose failure to resolve or download only emits a warning."
    }
  },
  "allOf": [
    {
      "if":   { "properties": { "type": { "const": "webcomponent" } }, "required": ["type"] },
      "then": {
        "required": ["webcomponents"],
        "not": {
          "anyOf": [
            { "required": ["main"] },
            { "required": ["programs"] },
            { "required": ["bin"] },
            { "required": ["root"] },
            { "properties": { "dependencies": { "required": ["java"] } }, "required": ["dependencies"] },
            { "properties": { "devDependencies": { "required": ["java"] } }, "required": ["devDependencies"] },
            { "properties": { "optionalDependencies": { "required": ["java"] } }, "required": ["optionalDependencies"] }
          ]
        }
      }
    },
    {
      "if":   {
        "anyOf": [
          { "properties": { "type": { "const": "bdl" } }, "required": ["type"] },
          { "not": { "required": ["type"] } }
        ]
      },
      "then": { "not": { "required": ["webcomponents"] } }
    }
  ],
  "definitions": {
    "dependencyBucket": {
      "type": "object",
      "additionalProperties": false,
      "properties": {
        "fgl": {
          "type": "object",
          "description": "BDL package dependencies. Keys are package names; values are semver constraint strings (e.g. \"^1.2.0\", \">=1.0.0 <2.0.0\").",
          "additionalProperties": {
            "type": "string",
            "description": "Semver constraint for this dependency."
          }
        },
        "java": {
          "type": "array",
          "description": "Java JAR dependencies, resolved from Maven Central unless \"url\" overrides it.",
          "items": { "$ref": "#/definitions/javaDependency" }
        }
      }
    },
    "hookList": {
      "type": "array",
      "items": { "$ref": "#/definitions/hookOperation" }
    },
    "hookOperation": {
      "type": "object",
      "additionalProperties": false,
      "required": ["op"],
      "properties": {
        "op": {
          "type": "string",
          "enum": ["copy-files", "mkdir"],
          "description": "Operation to perform. The vocabulary is closed; unknown ops are rejected at load time."
        },
        "from": {
          "type": "string",
          "description": "Source path or glob for copy-files. Relative to the hook's working directory; absolute paths and \"..\" traversal are rejected."
        },
        "to": {
          "type": "string",
          "description": "Destination path for copy-files. Same path constraints as \"from\"."
        },
        "path": {
          "type": "string",
          "description": "Target path for mkdir. Same path constraints as \"from\"/\"to\"."
        }
      },
      "allOf": [
        {
          "if":   { "properties": { "op": { "const": "copy-files" } } },
          "then": { "required": ["from", "to"] }
        },
        {
          "if":   { "properties": { "op": { "const": "mkdir" } } },
          "then": { "required": ["path"] }
        }
      ]
    },
    "javaDependency": {
      "type": "object",
      "description": "A Maven-coordinates Java JAR dependency.",
      "additionalProperties": false,
      "required": ["groupId", "artifactId", "version"],
      "properties": {
        "groupId": {
          "type": "string",
          "description": "Maven groupId, e.g. \"com.example\"."
        },
        "artifactId": {
          "type": "string",
          "description": "Maven artifactId, e.g. \"my-library\"."
        },
        "version": {
          "type": "string",
          "description": "Exact Maven version, e.g. \"1.2.3\". Ranges are not supported for Java deps."
        },
        "checksum": {
          "type": "string",
          "description": "Optional SHA256 hex digest of the JAR. When present, the downloaded JAR is verified. When absent, Maven Central is trusted without integrity checks."
        },
        "jar": {
          "type": "string",
          "description": "Override the computed JAR filename. Defaults to \"<artifactId>-<version>.jar\"."
        },
        "url": {
          "type": "string",
          "description": "Override the Maven Central URL entirely. Useful for mirrors or non-standard repositories."
        }
      }
    }
  }
}
