{
  "name": "sample-v6",
  "version": "1.0.1",
  "description": "fglpkg sample package requiring Genero 6 (prometheus package)",
  "author": "fglpkg samples",
  "license": "MIT",
  "repository": "https://github.com/leopatras/fglpkg",
  "genero": "\u003e=6.00",
  "dependencies": {},
  "root": ".",
  "files": [
    "*.4gl",
    "*.42m"
  ]
}
