{
  "name": "sample-v5",
  "version": "1.0.0",
  "description": "fglpkg sample package requiring Genero 5 (base.Channel.getExitStatus)",
  "author": "fglpkg samples",
  "license": "MIT",
  "repository": "https://github.com/4js-mikefolcher/fglpkg",
  "genero": ">=5.00.03",
  "root": ".",
  "files": ["*.4gl", "*.42m"]
}
