{
  "name": "sample-v6-42m",
  "version": "1.0.0",
  "description": "fglpkg sample package requiring Genero 6 (prometheus package), shipped as compiled .42m only (no source)",
  "author": "fglpkg samples",
  "license": "MIT",
  "repository": "https://github.com/leopatras/fglpkg",
  "genero": ">=6.00",
  "dependencies": {},
  "root": ".",
  "files": [
    "*.42m"
  ]
}
