{
  "name": "sample-img",
  "version": "1.0.1",
  "description": "fglpkg sample webcomponent package — a minimal image-display widget",
  "author": "fglpkg samples",
  "license": "MIT",
  "repository": "https://github.com/4js-mikefolcher/fglpkg",
  "keywords": [
    "webcomponent",
    "sample"
  ],
  "dependencies": {},
  "webcomponents": [
    "img"
  ]
}
