{
  "name": "hello",
  "version": "1.0.0",
  "description": "fglpkg sample package demonstrating the PACKAGE statement (PACKAGE hello, one PUBLIC FUNCTION helloworld())",
  "author": "fglpkg samples",
  "license": "MIT",
  "repository": "https://github.com/leopatras/fglpkg",
  "genero": "*",
  "dependencies": {},
  "root": ".",
  "files": [
    "*.4gl",
    "*.42m"
  ]
}
